Migos,*PLfQALVM3SEjLPDzDGOIw1Dh8eU8KQtHnq,rap...rapGame,,"Migos - ""Bad"" ft. Street Billionaires (Official Video),Sptr64R4OKE;Meek Mill Feat. Migos - Contagious [Music Video],HejK-34rONY;Migos - Bosses Don't Speak [Music Video],AUbbrUK-1hw;Migos- Narcos | HiiiKey Ayo & Teo Grim,1hidbybblYE;Migos - Narcos,unh8kWUuNt4;Migos - Is You Ready,VINnS6FKM54;Migos - Walk It Talk It ft. Drake,fGqdIPer-ms;Migos - Narcos (Audio),Xful8O9nTTs;Migos ft. Wiz Khalifa & Rae Sremmurd - Beamer (NEW 2018),gHV7y8h7K88;Migos - Stir Fry (Official),HI-mXMr8glQ;Migos - Notice Me (Audio) ft. Post Malone,vHZgnlZho50;Brvbus x Kaaris - Transfert,HMXCO6kzbb4;Migos - Cant 't Go Out Sad [Prod. By Ricky Racks] @beatbyjeff,Rqm_kRbWB-Y;Migos - Is You Ready (Audio/From ""Mile 22""),VINnS6FKM54;Gucci Mane - I Get The Bag feat. Migos [Official Music Video],uo14xGYwWd4",,migos,,
Post Malone,*PLegvV8yC11jYacAMlRXvasFH0dPuNsIRv,rap...rapGame,,"Post Malone - Psycho ft. Ty Dolla $ign,au2n7VVGv_c;Post Malone - No Time (NEW 2018),7MjIBHBfyac;Post Malone - Better Now,UYwF-jdcVjY;Dynamite Dylan ft. Post Malone - You (Official Video),bVtg4l1-eOM;Post Malone ft. 21 Savage - Rockstar (SKVNDV & WILD FUNK 2K18 REFLIP),eYQEobSmrFk;Post Malone Feat. Nicky Jam & Ozuna - rockstar Latin remix,qJKgfOUUrZo;POST MALONE - Broken Whiskey Glass -,jpelaelj14U;Post Malone - rockstar ft. 21 Savage (Steve Andreas Remix),3ctEWlAp5LU;Post Malone - Rockstar (Lyrics) ft. 21 Savage,louoxiUMBc0;Post Malone - rockstar ft. 21 Savage (Official Audio),4GFAZBKZVJY;MONDO GROSSO / ラビリンス,_2quiyHfJQw;Post Malone - ""Wow."" (Remix) feat Roddy Ricch & Tyga,lwWHn61Ty_A;Post Malone - ""Wow."" (Official Music Video),393C3pr2ioY;Post Malone - ""Wow."" Remix feat. Roddy Ricch & Tyga (Official Video),Em1uK7KKc6o;Post Malone - Go Flex,tQjsAJhsSw8;Post Malone - WOW (Alaskey Remix) 2019,hqNsB2g8sbk;Sam Feldt - Post Malone (feat. RANI) [Official Music Video],TewoJFN61mI;Post Malone - ""Goodbyes"" ft. Young Thug (Rated R),ba7mB8oueCY;Post Malone - Goodbyes ft. Young Thug (Rated PG),S4asq3SicN0;Sam Feldt - Post Malone (feat. RANI) [Joe Stone Remix] (Official Music Video),AbHTHrYGD5E;Sam Feldt - Post Malone (feat. RANI) (Friend Within Remix) [Official Music Video],uhS7LKDtNxU;Lil Pump ft. Chris Brown & Tyga - Post Malone (Music Video),h1bxr1JRoJQ;Post Malone - Die For Me (Audio) ft. Future Halsey,I_QpDE-Uco0;Post Malone - Take What You Want (Lyrics) ft. Ozzy Osbourne & Travis Scott,T_9c4pDQMOQ;Post Malone - Myself (Audio),gqthPT8vK7o;Post Malone - Saint-Tropez (Official Video),MRyLC2M1K2w;Sam Feldt - Post Malone (feat. RANI) [Club Mix] (Official Music Video),L6ZpPAeef7o;Post Malone - Circles,wXhTHyIgQ_U",,postmalone,,
A Boogie,*PLLQ4C_mDWRDRoc-dDb8gFtAGNzZQkq5Be,rap...rapGame,,undefined,,aboogie,,
J Balvin,*PL0XPfRbuGHYZ5tltFzgJB2KZ_6t14Q2wk,rap...rapGame,,"J. Balvin - Reggaeton,6DHDIDgn2oA;Enrique Iglesias ft. J Balvin - Mil Pedazos (New 2018) Music video Mashup,LUam9V8Jzcg;J. Balvin - Reggaeton (Official Video),6DHDIDgn2oA;Anitta - Veneno (Official Music Video),LoYYtYjB3h4;Byrd Villi - Jungle 12 - August 2018,DpkUvpbNtWc;J Balvin - En Mí (OFFICIAL COVER VIDEO),QQ32k5yqTmY;J Balvin - Snapchat (Live at BRUUTTAL),uhk9diAxpVY;J Balvin - Si Tu Novio Te Deja Sola ft. Bad Bunny (Video Oficial),Km4BayZykwE;J. Balvin - La Rebelión,vfN_HealI84;J Balvin - Our Way Of Life Feat Ozuna, Farruko, Ky-Mani Marley (Oficial Mashups - Remix Her David),o4-JSTFUcLA;J Balvin - Our Way Of Life Feat Ozuna  Farruko  Ky-Mani Marley (Oficial Mashups - Remix Her David),o4-JSTFUcLA;J Balvin - Atrevido Feat. Maluma Luis Fonsi ( Video Oficial - Mashups Cover - Her David ),IwA26XUTYFM;J. Balvin - Blanco (Official Video),8j1xiiAZhIQ",,jbalvin,,
Wale,*PLMGEnkIQokJqdojC4UkDuLNXFhp-m25H5,rap...rapGame,,"Wale - Wale Performs Acapella Version of ""Ungrateful & Thankful"",-lUZKemLPJk;Wale - Black Bonnie (feat. Jacquees) (Official Video),KmR47_vyD2w;Kwesta - Spirit ft. Wale,P36O8dPuGDo;Rudeboy - Onyinye ft. Wale (Official Video),eV5Ocn3Thr0;Wale - On Chill (feat. Jeremih) [Official Music Video],iX9ICUr1yEw",,wale,,
Gucci Mane,*PLQo4-T96b_T4qPYlR7KE0PS8SLp6MoSeI,rap...rapGame,,"Gucci Mane - I'm Not Goin' (feat. Kevin Gates) [Official Music Video],DEIUzqLFNPM;Masicka - Stay Strong (Audio Video),L0Y5gkojzoA;Bums - Deh Yah Same Way - August 2018,7my9RBDzS80;Wiz Khalifa - Real Rich feat. Gucci Mane [Official Music Video],9nV9GNjXFDo;Gucci Mane - The Hood Classics [Full Mixtape + Download Link] [2011],rT1myrSIhes;Future Fambo - How We Living Remix ft. Gucci Mane,tbRevh-_sfs;Gucci Mane - Kept Back feat. Lil Pump [Official Music Video],DN6WWu_KEQs;Gucci Mane  - Curve (ft. The Weeknd),NVCqz2BDfcQ;Gucci Mane - Enormous feat. Ty Dolla $ign [Official Music Video],EW6TP7o_o5U;Dreezy - We Gon Ride ft. Gucci Mane,wIqJfixrJu8;Offset - Quarter Milli ft. Gucci Mane,Z51iEGMPQ9o;Le A - PMU,gyKtFyvb5Z8;Gucci Mane feat. Meek Mill ""Backwards"" Music Video BTS (WSHH Exclusive - Official Music Video),sp1EA-mpBwk;Quality Control Migos  Lil Yachty - ""Intro"" feat. Gucci Mane (Official Music Video),jf2bM4bjzUA;Gucci Mane - I Get The Bag feat. Migos [Official Music Video],uo14xGYwWd4;Gucci Mane - Big Booty feat. Megan Thee Stallion [Official Video],ypdY_UJUWpk;Gucci Mane - Big Booty feat. Megan Thee Stallion [Official Audio],b_Kx8tx88oQ;Gucci Mane - Bucking the System feat. Kevin Gates [Official Audio],d-AaaJuR7cU;Gucci Mane Ft. DaBaby & NBA YoungBoy ""Richer Than Errybody"" (Music Video),e8mEJ-mUiX0",,guccimane,,
Juicy J,*PLK-JT3Ii9QKBrQceo66nn0orLuFGYiusE,rap...rapGame,,"Juicy J - Neighbor (Official Video) ft. Travis Scott,WkSHRrFZFUA;Juicy J - Neighbor (Official Audio) ft. Travis Scott,9mLIVaHp4A4;Juicy J - Let Me See (Official Video) ft. Kevin Gates Lil Skies,p578E7tC9EA;Juicy J - One of Those Nights ft. The Weeknd (Explicit),VP7GNxLI9fM;Megan Thee Stallion - Simon Says ft. Juicy J (Official Audio),i2wX5fDoJXg;Juicy J feat. Wiz Khalifa - Smoke A Nigga,nBApNtVeLfs;Juicy J ft. Travis Scott - Neighbor (Official Video),WkSHRrFZFUA",,juicyj,,
Wu Tang Clan,*PL9uczDoXQxSaxoyw9Ye08vbTH7BkQDz0e,rap...rapGame,,undefined,,wutangclan,,
Lil Durk,*PL4n7yneXyGu11kEarEhiHzU3RIh6837GP,rap...rapGame,,"Lil Durk Feat. Young Dolph & Lil Baby ""Downfall"" (WSHH Exclusive - Official Music Video),jGMSBaMF7oc;Lil Durk Feat. Future ""Spin The Block"" (WSHH Exclusive - Official Audio),r-2ph_RyFD0;Lil Durk Feat. Valee ""Do The Most (Prod. by Young Chop) (WSHH Exclusive - Official Audio),kC7-EnVEuPg;Lil Durk Feat. YFN Lucci ""Dirty Diana"" (WSHH Exclusive - Official Audio),4cnOdkcOguU;Lil Durk - India (Official Music Video),2hDVOQdt6cg;Lil Durk - Die Slow feat. 21 Savage (Official Audio),5dVTGWbsvyY",,lildurk,,
Young Thug,*PL7sdy1jcOYJ1EuXxuQ9YOT07kRwTkjk47,rap...rapGame,,"Young Thug - Chanel (ft Gunna & Lil Baby) [Official Video],yCPCqbwfe58;Young Thug - Chanel (Go Get it) (ft. Gunna & Lil Baby) [Official Visualizer],da4Z0sgURMQ;Young Thug - Back Bone (Before Anythang),cYhZD6IA88g;Camila Cabello - Havana ft. Young Thug (Mr.UNKWN Remix),3ly_TBgIE0A;Young Thug - Climax (ft. 6LACK) [Official Audio],t5O4lLUSJL4;Young Thug - Sin (ft. Jaden Smith) [Official Audio],eHrGwEypJ2U;Young Thug - Dirty Shoes (ft. Gunna) [Official Video],8nxbrb3h8pE;Young Thug - On The Rvn (Full Album),_raT66kJTEA;Young Thug - Gain Clout [Official Video],WlkgstWUBgs;Young Thug - It's A Slime (ft. Lil Uzi Vert) [Official Visualizer],UuxyIZEGGbk;Young Thug Feat. Gunna ""Dirty Shoes"" (WSHH Exclusive - Official Audio),rFwywuxP6p0;Young Thug Feat. Lil Baby & Gunna ""Chanel (Go Get It)"" (WSHH Exclusive - Official Audio),ni4DfcZV8L8;Young Thug Feat. Lil Uzi Vert ""It's A Slime"" (WSHH Exclusive - Official Audio),O_yWnNNvLEk;Young Thug - Slimed In (ft. Nechie) [Official Visualizer],LT2bNg6-2eM;Young Thug - U Ain't Slime Enough (ft. Karlae & Duke) [Official Visualizer],jthTikpbNzI;Young Thug - Tsunami [Official Visualizer],DKdG7QzQCCI;Future ""Show My Chain Some Love"" ft. Young Thug (Music Video),4B8v2IHZ6ko;Young Thug - Up feat. Lil Uzi Vert [Official Music Video],OSAAGrnZt8Q;Swizz Beatz - 25 Soldiers ft. Young Thug,a8pVhWpujl4;Young Thug - You Said Feat. Quavo [New Song],dG3-FdSUQlI;NAV - Tussin ft. Young Thug (Official Audio),OrE7Zll82Gs;Young Thug - Halftime [Official Video],KyCTZ8c-trc;Young Thug - The London (ft. J. Cole & Travis Scott) [Official Audio],OKhT_6XtD7I;Davido - Crazy Love ft. Young Thug (Official Video),YhRv3rtHrd0;Post Malone - ""Goodbyes"" ft. Young Thug (Rated R),ba7mB8oueCY;Post Malone - Goodbyes ft. Young Thug (Rated PG),S4asq3SicN0;Young Thug - The London ft. J. Cole & Travis Scott [Official Video],G8Hp-AKrfm0;Young Thug - Surf ft. Gunna [Official Video],e0t9RpSje7w;Young Thug - Lil Baby (Official Audio),_fbFS2Yo-wE;Young Thug - ""Hercules"" (Prod. by Metro Boomin),2TOB2McGSVw;Young Thug - What's The Move ft. Lil Uzi Vert [Official Video],L32ZHlOqqGY;Young Thug - Hot ft. Gunna & Travis Scott [Official Video],leJNDpm_G10;Young Thug - Hot ft. Gunna & Travis Scott [Official Music Video],leJNDpm_G10;Young Thug - Hop Off a Jet ft. Travis Scott [Official Audio],6E5VX5ZqJps",,youngthug,,
Future,*PLJ6z_vXJKxu3dp6fxPJ6FKg0aYPoI9CeT,rap...rapGame,1,"Future - Mask Off (Reggae Remix by Sentinel X Irievibrations X Youngheart),sMsfSz-t678;Future - With You ft. Wizkid (Official Video),7826Kq1Ul3Y;Future - Crushed Up,YMrcUaI6NUA;*New* Tyga Ft Travis Scott 21 Savage & Gucci Mane (2018) ""Speedin"" (Explicit),6wCczgkJgO0;● Чёрная Татуха ●,YA7YnO2qXqs;Maroon 5 ft Future: Cold | Kizomba Remix by JP Beatz,eoRK3llzSME;Future - Blood On the Money (Official Music Video),2y-edrXIZjA;Future - Jumpin on a Jet,vJLr9mpcY8Q;Slightly Stoopid - Mellow Mood (feat. G.Love),HBh17_dmaFw;Galawasp Arcus - OHHH (Raw) October 2018,WA_UJnPgyB8;Future - Low Life (Official Music Video) ft. The Weeknd,K_9tX4eHztY;Future - Forgive Me Ft. 21 Savage (NEW 2018),iPpksW38opw;Future - RACKS BLUE (Official Audio),4N5x1HpiuJs;Future - 31 DAYS (Official Audio),rcTIq5mtRRM;Rick Ross - Green Gucci Suit ft. Future (Official Video),bV_QeJ3qLFk;Future - No Shame (Official Music Video from ""SUPERFLY"") ft. PARTYNEXTDOOR,y5SxNJSGDTw;Tory Lanez - Real Thing ft. Future,Udd6cR9va4s;A!sachie - Future - October 2018,YFMsdgqqujI;Future - Unicorn Purp (Audio) ft. Young Thug Gunna,TwOpW6dP7FU;Future - Stick to the Models (Audio),QAcHcuqY_rs;Future - Rocket Ship,88vIo2Dd0kc;Future - Feds Did a Sweep (Official Music Video),c8rzM_3wepE;Future - You Da Baddest (Official Music Video) ft. Nicki Minaj,2DBBb3_p8eg;Future - Extra Luv (Official Music Video) ft. YG,bgKJiXf5KkY;Future - First Off (Audio) ft. Travis Scott,BeYG-tboiOU;Future - Goin Dummi,EkwyWSAiUq4;Future - PIE (Official Music Video) ft. Chris Brown,obWywMv-N4k;Future - ""Promise U That"" Official Live Performance | Vevo,wq08GlOh1L4;Future - Never Stop (Official Music Video),nNS3ye93eZA;Future - ""Call The Coroner"" Official Live Performance | Vevo,TYYAtoZ-QeQ;Future - Goin Dummi (Official Music Video),EkwyWSAiUq4;Future - Jumpin on a Jet (Official Music Video),vJLr9mpcY8Q;Future - Crushed Up (Official Music Video),YMrcUaI6NUA;6LACK - East Atlanta Love Letter ft. Future (Official Music Video) ft. Future,VsLpPqyksec;Kaaris - Crystal ft. Future,kN09y8oiTrA;Future - XanaX Damage (Audio),E2M-6Ye32Ts;Future - Love Thy Enemies (Audio),HmMh6TaoQ8g;Future - Government Official,tR2q-L_XZkE;Future - Please Tell Me (Audio),lqwGshj-IoQ;Future - St. Lucia,EbxGAtxfs14;Future - 100 Shooters (Audio) ft. Meek Mill Doe Boy,kPqFxSmCPJc;Lil Baby - ""Out The Mud"" ft. Future (Official Music Video),aWotrzyK5GA;Future - Comin Out Strong (feat. The Weeknd) Music Video,NYivX_GnFUY;FKA twigs - holy terrain feat. Future,WEJRyBWpuvA;Doe Boy ft. Future - ""Most Wanted"" (Official Music Video),zYuPVJPzEAc;Future - 2Pac (Audio),sACqZlAp5bI;Future - Radical (Audio),Gox1TLaPzbc;Future - Codeine Crazy (Audio),O7eVICpL8FY;Tinashe ft. Future - Faded Love (Vertical Video),UOfgkkHEcfU;Future - Last Name (Official Music Video) ft. Lil Durk,TmZhesvByUg",,future,,
Lil Wayne,*PLasA1IRBDbhwJZnfTgsGXEMw5o7eB5izr,rap,5,"Nicki Minaj - Good Form ft. Lil Wayne,M8GX0cZ-xtw;Lil Wayne - Uproar ft. Swizz Beatz,GQ2juiyXk-s;Lil Wayne - Family Feud feat. Drake (Official Audio) | Dedication 6 D6 Reloaded,PjqKPHZJgF0;Lil Wayne - Carter Gang ft. Wizkid Ciara (Official Video),_w4_Cvb45Vc;Lil Wayne - Don’t Cry ft. XXXTENTACION,fkLLeOCOQ3w;Diplo - Oh Maria (feat. Soolking) (Official Lyric Video),9g9FBXq04VY;Lil Wayne- Mona Lisa Ft. Kendrick Lamar (Carter V),Mw1YeNQ1UWE;Lil Wayne - Baby ft. Akon Young Jezzy,T98EbF4xLvg;Birdman Juvenile - Ride Dat ft. Lil Wayne,49Ggx4ZafL8;Wizkid Ft. Lil Wayne - Light Up (Official Music Video),UodvOf7VIYo;Lil Wayne ft. Akon T.I. - She's My Hero,ik3ErZj16xM;Lil Wayne ft. Offset Quavo  Takeoff - Crazy (Official Video),VTPmCtzZxu4",,lilwayne,,
Ariana Grande,*PLFO0esT_hEQSS4vqO1nh5i6TRyIvsMXAN,R&B,6,"Ariana Grande - The Light is Coming ft. Nicki Minaj (Edited Video),fsEnhDNLJc0;Ariana Grande - the light is coming ft. Nicki Minaj,OQitfe8u7i4;Ariana Grande - Gimme On Up ft. Nicki Minaj (Official Video),lUgEoHf3Y0E;Nicki Minaj - Bed ft. Ariana Grande (Official Audio),iEky5pIDxJM;Ariana Grande - God is a woman,kHLHSlExFis;Vicetone - Fix You (Official Lyric Video),FUsM96Ycq78;Ariana Grande - God is a woman (Live on The MTV VMAs/2018,sKm4YqadSGw;Ariana Grande - God is a woman (Full Acoustic Performance) (Good Morning America),YaN4uZDTu4M;Ariana Grande - breathin,QTPW_cIYp9o;Ariana Grande - breathin (audio),1BYr1br2Ee4;Ariana Grande - thank u next (lyric video),EEhZAHZQyf4;Ariana Grande - no tears left to cry,ffxKSjUwKdU;MaskiriTrevor Dongo and Leonard Mapfumo - Daira (Official Video),GNXrmFPw3cQ;ARIANA GRANDE - BREAK FREE [ REGGAE REMIX ],cz6cvfJGf1s;Never Wanna Lose You (feat. Justine Skye & Jesper Jenset),M1UVcXW0gcQ;Ariana Grande - 7 rings,QYh6mYIJG2Y;2 Chainz - Rule The World ft. Ariana Grande,zh4J-yW3LHw;Ariana Grande - break up with your girlfriend i'm bored,LH4Y1ZUUx2g;Ariana Grande - Havana (ft. Camila Cabello),dt4Bk-GhsEE;Stevie Wonder - Faith ft. Ariana Grande,hNMMN46uFCc",,arianagrande,,
Soprano,*PL9ZHu0YAehjxkA0Z_KnWIBlqs3TWjWma6,R&B,4,"Soprano - À la vie à l'amour (Clip officiel),CEGZbjl9J98;Soprano - Zoum feat. Niska (Clip officiel),jQgrOe93kRQ;MC Pedrinho - Cinderela (GR6 Filmes) Jorgin,EeYAJb1o9rg;Hek Ubada || Sushitra Wangkhem & Romen Naoroi || Roshan Thoudam || Official Music Video Release 2018,TJd3vttObek;Tiken Jah Fakoly - Le monde est chaud ft. Soprano,RWWWHjMD3Ok;Bramsito - Millions de mélos ft. Soprano,zydfq7BtkE8;Soprano - Le Coach feat. Vincenzo (Clip officiel),8NyParAaNos;Soprano - Fragile (Clip officiel),zgBEVbDzuu4;Bramsito - Millions De Mélos ft. Soprano,0Tq8UljdY-Y;Ghetto Phénomène feat. Soprano - La Vida (Clip Officiel),oyZhscnGYbQ;Soprano - À nos héros du quotidien (Clip officiel),fVuCviFkqNw;Soprano - Papa Sopra (Clip officiel),__12XONxA7I",,soprano,,
Ne-Yo  Mario,*PL391E1D92ED8E779D,R&B,,"2NE1 - GOODBYE,5C4vxAV54xs;Ne-Yo Bebe Rexha Stefflon Don - PUSH BACK (Official Music Video),e5WC-9TbjjQ;Ne-Yo - GOOD MAN,3xv9YIOKIZw;2NE1 - GOTTA BE YOU -2014 WORLD TOUR ～ALL OR NOTHING～ in JAPAN Ver.-,9k_R0b3mvwA;2NE1 - I LOVE YOU -2014 WORLD TOUR ～ALL OR NOTHING～ in JAPAN Ver.-,uFjBRINDYVQ;2NE1 - DON'T STOP THE MUSIC -2014 WORLD TOUR ～ALL OR NOTHING～ in JAPAN Ver.-,bOdSQMloGIk;2NE1 - I DON'T CARE -2014 WORLD TOUR ～ALL OR NOTHING～ in JAPAN Ver.-,gqbj7_lS1x0;2NE1 - CAN'T NOBODY (ENG VER),zaXVjlBPGeY;2NE1 - I AM THE BEST -2014 WORLD TOUR ～ALL OR NOTHING～ in JAPAN Ver.-,KpGnv38naMo;2NE1 - CAN'T NOBODY - 2012 YG Family Concert in Japan ver.,-CLM2_yUTuA;2NE1 - SCREAM -2014 WORLD TOUR ～ALL OR NOTHING～ in JAPAN Ver.-,rPMzAG3lx8g;2NE1 - MISSING YOU -2014 WORLD TOUR ～ALL OR NOTHING～ in JAPAN Ver.-,ut75XUh-kt0;2NE1 - I DON'T CARE - 2012 YG Family Concert in Japan ver.,muIjhasHrCU;2NE1 - THE BADDEST FEMALE & MTBD (CL Solo) -2014 WORLD TOUR ～ALL OR NOTHING～ in JAPAN Ver.-,HpoD78UK7fM;2NE1 - GOTTA BE YOU (ENCORE) -2014 WORLD TOUR ～ALL OR NOTHING～ in JAPAN Ver.-,hX9-JGRmrFg;2NE1 - UGLY -2014 WORLD TOUR ～ALL OR NOTHING～ in JAPAN Ver.-,VuOM6gkT6zw;2NE1 - COME BACK HOME -2014 WORLD TOUR ～ALL OR NOTHING～ in JAPAN Ver.-,B_JeVFSW72Y;2NE1 - FIRE - 2012 YG Family Concert in Japan ver.,sBMyucIx0_w;2NE1 - UGLY with Gummy - 2012 YG Family Concert in Japan ver.,YQ7Gx1snXL0;2NE1 - IF I WERE YOU -2014 WORLD TOUR ～ALL OR NOTHING～ in JAPAN Ver.-,E5Bh0xZH4CA;2NE1 - CAN'T NOBODY -2014 WORLD TOUR ～ALL OR NOTHING～ in JAPAN Ver.-,ChftCC4IQYA;2NE1 - COME BACK HOME (UNPLUGGED VER.) -2014 WORLD TOUR ～ALL OR NOTHING～ in JAPAN Ver.-,h18msiHOh6c;2NE1 - LONELY -2014 WORLD TOUR ～ALL OR NOTHING～ in JAPAN Ver.-,nknwc5sbk1c;2NE1 - GO AWAY -2014 WORLD TOUR ～ALL OR NOTHING～ in JAPAN Ver.-,yN9VqEtjm8E;2NE1 - I AM THE BEST - 2012 YG Family Concert in Japan ver.,BPaowlx5B4o;2NE1 - GO AWAY - 2012 YG Family Concert in Japan ver.,UkAjmD6lEPE;2NE1 - DO YOU LOVE ME -2014 WORLD TOUR ～ALL OR NOTHING～ in JAPAN Ver.-,jTDtobb4Y58;2NE1 - PRETTY BOY -2014 WORLD TOUR ～ALL OR NOTHING～ in JAPAN Ver.-,4B_3z1Iudzw;2NE1 - CLAP YOUR HANDS -2014 WORLD TOUR ～ALL OR NOTHING～ in JAPAN Ver.-,jSkmmcTYHMc;2NE1 - HATE YOU,IINY0a-F3lg;2NE1 - HAPPY,B4iGFlRp-9w;2NE1 - FALLING IN LOVE,OjhtHCJf1XU;2NE1 - CRUSH,I7SlM_8cWNI;2NE1 - DON'T STOP THE MUSIC - 2012 NEW EVOLUTION in Japan ver.,QCZt1eAukxk;2NE1 - FOLLOW ME - 2012 NEW EVOLUTION in Japan ver.,Aq-dAFadzEo;2NE1 - I DON'T CARE (REGGAE MIX) - 2012 NEW EVOLUTION in Japan ver.,vwQlDIpk_DM;2NE1 - CLAP YOUR HANDS - 2012 NEW EVOLUTION in Japan ver.,7y6UOeWnO6I;2NE1 - DON'T CRY & YOU AND I by BOM (from 2NE1) - 2012 NEW EVOLUTION in Japan ver.,DRlssOBgtZg;2NE1 - PRETTY BOY - 2012 NEW EVOLUTION in Japan ver.,d2CkGtvuHXw;2NE1 - LONELY - 2012 NEW EVOLUTION in Japan ver.,RA4uxeLZGk0;2NE1 - IT HURTS - 2012 NEW EVOLUTION in Japan ver.,ycpzP33cnjs;2NE1 - IN THE CLUB - 2012 NEW EVOLUTION in Japan ver.,5H1WAWS-7BM;2NE1 - KISS by DARA (from 2NE1) - 2012 NEW EVOLUTION in Japan ver.,1NlqmWIoDeE;2NE1 - I AM THE BEST - 2012 NEW EVOLUTION in Japan ver.,xQ7ABppKr_k;2NE1 - STAY TOGETHER  NOLZA in Japan”Ver.,fc7x9-2pHrU;2NE1 - UGLY  NOLZA in Japan”Ver.,65Olr2ETikA;2NE1 - GO AWAY  NOLZA in Japan”Ver.,RiWUiSeHqYo;2NE1 - HATE YOU - 2012 NEW EVOLUTION in Japan ver.,PjSmb9SXWeo;2NE1 - I DON'T CARE - 2012 NEW EVOLUTION in Japan ver.,EIIS0n30EYU;2NE1 - LET'S GO PARTY - 2012 NEW EVOLUTION in Japan ver.,t81NTgKo4Fc;2NE1 - CAN'T NOBODY - 2012 NEW EVOLUTION in Japan ver.,i2TJiMgr9NI;2NE1 - GO AWAY - 2012 NEW EVOLUTION in Japan ver.,GEc_pRGmV8M;2NE1 - SCREAM - 2012 NEW EVOLUTION in Japan ver.,y53i-5bYXf4;2NE1 - I AM THE BEST (Encore ver.) - 2012 NEW EVOLUTION in Japan ver.,LpTy2SkoSbQ;2NE1 - I LOVE YOU - 2012 NEW EVOLUTION in Japan ver.,GLOymcAaBxM;2NE1 - STAY TOGETHER - 2012 NEW EVOLUTION in Japan ver.,pj1LAzsmHFU;2NE1 - UGLY - 2012 NEW EVOLUTION in Japan ver.,CxoEpG5ZuA4;Only Can Get Better (Official Video),_uBO64C7NlI;Ne-Yo - One In A Million (Official Music Video),6tpl9LtkRRw;Eric Bellinger - Dirty Dancing ft. Ne-Yo (Official Music Video),ht5BvV5FgCA;Nef The Pharaoh ""Tap Yo Pussy"" (WSHH Exclusive - Official Music Video),-jPN6AF-D00;David Guetta - Play Hard ft. Ne-Yo Akon (Official Video),5dbEhBKGOtY;Ne-Yo Bebe Rexha  Stefflon Don - PUSH BACK,e5WC-9TbjjQ;Ne-Yo - This Christmas,HRn5--Xdapsundefined",,ne,yomario,
Kelly Rowland,*PLAYfaozwzJ26pu5GgsaZEwQfJwnBM4mlC,R&B,,"Ciara - ""Girl Gang"" ft Kelly Rowland,NKYIFEYwMxI;Verse Simmonds ft. Kelly Rowland - Boo Thang (Official Video),ElWiBlP-FrU",,kellyrowland,,
Frank Ocean,*PLzF2lckq8ay-mMfQu_8F-qLCiaUUPXmBw,R&B,,undefined,,frankocean,,
Ciara,*PLaFT49lKqsFqjFQphHme9OF1nox4JT9TV,R&B,,"Ciara - Good Loving ft. Wizkid (Official Video),OCFZnmUDt2U;Ciara - Level Up,Dh-ULbQmmF8;Ciara Ft Tekno - Freek Me [Official Music Video],rkvkMWlrTNw;Wizkid ft. Ciara - Turn Up (Official Video),aS2gTD975wc;Ciara Ft Tekno - Freek Me [ Music Video],rkvkMWlrTNw;Ciara - ""Dose"" Pep Rally,Fleul1h7Fps;Ciara - Freak Me  ft Tekno [Official Video],gbBXgizyMf8;Ciara - Thinkin Bout You  [OFFICIAL VIDEO],kVczk4uIPPg;Ciara - ""Girl Gang"" ft Kelly Rowland,NKYIFEYwMxI;Ciara - Greatest Love [OFFICIAL VIDEO],5BjpWJyd_hk;Ciara - Melanin ft. Lupita Nyong'o Ester Dean, City Girls, La La,o6FrXELTAMQ;Ciara - Melanin ft. Lupita Nyong'o Ester Dean  City Girls  La La,o6FrXELTAMQ",,ciara,,
Jennifer Lopez,*PL8LJJ1Zu1yOGhYGwu78VwLVOqfCSzdl9a,R&B,,"Jennifer Lopez - El Anillo (Official Video),LryQJ25CnKU;Jennifer Lopez - Acting Like That (feat. Iggy Azalea) [Audio],F9aTYEfE1vA;Jennifer Lopez - Baila Conmigo,S_m7o5YMLoM",,jenniferlopez,,
Blacko - Dualité (Album Officiel),*PL-vZW0I2tk2ucu0W0mPdZ4FGZucjqOqmv,R&B,,"Blacko - Vision (2017),LwQew_cfiGs;Blacko - Testament,VoYmdv6o8dw;Blacko - Ce qui ne tue pas rend plus fort,TVUDvmdtAj4;UCee - All Night [Official Video 2018],S5SPVGEI5zM;Christopher Martin - Look On My Face (Official Video) prod. by Silly Walks Discotheque,F0SFX8ji4h8;Charly Black @ SummerJam 2018,3nb7nI2oLlA;Ghetto Days Riddim Mix (Full) Feat. Nature Ellis Zagga Singer J Diligence (July 2018),jNkxgvEpZI8;Blacko - L'encre de tes yeux (Cover) 2019,Mqoh5QUnOxw;Blacko - Accroché à mes Rêves (Clip Officiel),RDoqri1VL8cundefinedundefined",,blacko,dualité,albumofficiel
R. Kelly,*PLNF1TtPlNbF87k2HshqLCpvEFTSlrspTB,R&B,,"Fally Ipupa - Nidja feat. R. Kelly (Clip officiel),SfKH-6lPwAI",,rkelly,,
Keyshia Cole,*PLjqOCO8jzpc7bNH7JVdCoyWNLPxhz-tpH,R&B,,"Keyshia Cole - I Ain't Thru ft. Nicki Minaj (Official Video),jdLAvOMHpqo",,keyshiacole,,
Beyonce,*PLgXJI_F2zukKbzkBy1iTUsSdEWcWJHIIm,R&B,,"Beyonce - With You Ft. Wizkid [Official Video],HlKJdLWNi6I;Beyonce - Don't Jealous Me (LYRICS VIDEO) ft. Tekno Mr. Eazi, Yemi Alade 🎶,fm0j5g-U7F4;Beyonce ft  Shatta Wale & Major Lazer  - Already,J7y9wgG_54s;DONT JEALOUS ME - YEMI ALADE MR EAZY  TEKNO  LORD AFRIXANA (BEYONCE - THE GIFT),_NZIQOdT-RA",,beyonce,,
Justin Timberlake,*PLBAHmVTbbf934roMy0-hw5PD2RiOTOg9y,R&B,,"Justin Timberlake - SoulMate (Audio),NxJ7O0CGzO8;Basshunter - Angel In The Night (Official Video),DC9Ar8gYNa4;Justin Timberlake  Feat Chris Stapleton  - Say Something live spotify concerts 2018,tD7iCDNK0Ng",,justintimberlake,,
Kali Uchis,*PLWsvleiwEZJKd1mznHIB5OclmWgNeDL-x,R&B,,"Kali Uchis - Just A Stranger ft. Steve Lacy,IUcByj96dUA;Kali Uchis - Killer | A COLORS SHOW,MYESVkUxWxM;Kali Uchis - Nuestro Planeta ft. Reykon,TvYbR0mr0mk;Leticia Tridico e Gui Martinelli - Nada Nos Abalará (kondzilla.com),MtvAwiFcqNo;Ragga da Escondida 2019,1KmhFb59tL0;Ryme Minista - Allaa Dat [Official Music Video HD],uaTwv8rkp28;Kali Uchis - Tyrant ft. Jorja Smith,KDUOLz9ZL2g;Kali Uchis - After The Storm ft. Tyler The Creator Bootsy Collins,9f5zD7ZSNpQ;Kali Uchis - Dead To Me (Acoustic),mbwUs1rnuQg;Daniel Caesar - Get You ft. Kali Uchis [Official Video],uQFVqltOXRg;Kali Uchis - After The Storm ft. Tyler The Creator, Bootsy Collins,9f5zD7ZSNpQ;Kali Uchis - Dead To Me (Official Acoustic),mbwUs1rnuQg;Kali Uchis - Solita (Official Video),MTdj-6Bd5wk",,kaliuchis,,
Fantasia Barrino,*PLtG2BW3YFaXG_KmRXIsydoKt0UpZQqBTA,R&B,,undefined,,fantasiabarrino,,
Usher,*PLJkqBXPzFZPh7y4atXTfEEh41iKADkixa,R&B,,"Usher - Yeah! (Kees Sjansen Remix),HNoP0y7Le1I;JO - In lipsa ta (Official Video),oyodvRsWlAA;Jukebox & Bella Santiago - Sugar Gumalaw (Official Single),KdQOprnRkwQ;MIA D. - Да Бебе [Official Video],aLAa4Lf0jx4;Yuna - Crush ft. Usher,9SGHPQ2FVm8",,usher,,
Alicia Keys,*PLn3RU2qrqR1sTih7Z8d9o3fhQCZjv9Rwc,R&B,,"Alicia Keys - Fallin',Urdlvw0SSEc;Ari Lennox J. Cole - Shea Butter Baby (Official Music Video),FFuZ2avoYmw;Alicia Keys - Fallin' (Official Music Video),Urdlvw0SSEc;Alicia Keys - Raise A Man (Official Video),ImJ-1cxsYrM;Alicia Keys - You Don't Know My Name (Official Music Video),_ST6ZRbhGiA;Alicia Keys - Show Me Love (Visual Sonic Experience) ft. Miguel,vNf1tfEtfXI;Alicia Keys - Time Machine (Official Video),NFCsuDcWqY0;Alicia Keys - Show Me Love (Official Remix Video) ft. 21 Savage Miguel,Qr1kiCDAdxQ;Alicia Keys - Show Me Love (Live) ft. Miguel,T5O8OXKJzeA",,aliciakeys,,
