Waka Flocka Flame,*PLwDoU3lYsMZtFCECqxRHI3QuBBeLHHhRH,rap...rapGame,"2,00","bbno$ & andrei  - mr. miyagi ft. waka flocka flame,zFxgKZmDHrM;Waka Flocka Flame - ""No Hands"" ft. Wale & Roscoe Dash (Official Video),skhxizRYxps;Waka Flocka Flame - "" For My Dawgs "",RPmIn0iD_mA;Stephen Marley - Scars On My Feet ft. Waka Flocka Flame,WmfgK5-xBUI;David Lindley - ""Bye Bye Love"" | Central Reggae,8eqQr4I_tJU;Waka Flocka Flame - Chris Paul John Wall ft Jimmy Da Rocket & Luh Shotta E,9juplkH_B0k;Waka Flocka Flame - Round Of Applause feat. Drake (Official HD Video),j5Z3KUOrhS0",,wakaflockaflame,,
Rihanna,*PLmayP0qOPHaK0E_ubNJwHWn3h3UP5L0Gk,R&B,"0,00","Rihanna - Love Answers (Official Video),AcfvohG28eI;Rihanna - Your Love ft. Maroon 5 [Music Video],rMgKabcF1fU;Rihanna - To My Bed [Official Video],KdnaCgc7tj4;Rihanna - Back To You [Official Video],f2Cub7s7RCc;Rihanna - Love On The Brain (Explicit),zA-upjFaHvw;Rihanna - Mercy ft. WizKid (Official Music Video),PDq_IHl6y7g;Rihanna - Stay ft. Mikky Ekko,JF8BRvqGCNs;Rihanna - Birthday Cake (feat. Chris Brown),okeDc2eSJxE;Rihanna - Rude Boy (Tomy B Remix),pIXCkSurN24;Jeezas - We Got Doe - December 2018,Ko0l93NdegM;Rihanna - Cockiness (Love It) (Remix) (Explicit) ft. A$AP ROCKY,28t-OtYNtXA;FourNine - Jim Jones [Music Video] | Link Up TV,FEvuCb81DRs;Khalid Kane Brown - Saturday Nights REMIX (Official Video),5hqK-A0UxKw;Rihanna - How I Feel (NEW SONG 2019),TVKy7_zeon0;Plan B - Guess Again [OFFICIAL VIDEO],vv3VfXZtus4;Rihanna - Warned ft. The Weeknd Future,ABNZmBN5m7U;Rihanna - Angel ft. Zayn,ZSkGZmGhAT8;Yxng Bane - Rihanna (Official Music Video),1ruitsqQ34c;Rihanna Ft. Cardi B - Fall Out (Official Music Video),Ylv-wS9QaiA;Rihanna - Te Amo (Mert Altın Kizomba Mix),obVvNIC6Ktw;FIITU x MC LAN - Rihanna [prod Fiitu],YqkwJVAvSiM;Rihanna - Tonight ft. 21 Savage (Official Video),NEvLqiz1zJM",,rihanna,,
MGK,*PLdwwWqoY5XpGMKrUowE53uqVqqKcgPpaW,rap...rapGame,"3,00",undefined,,mgk,,
Chevy Woods - (mixtape),*PLClmWKrXQ6xpdDZfRsQwhndPRbTHP03Tz,rap,"5,00",undefined,,chevywoods,,
Snoop Dogg,*PLgXtP7yM0g1ZFYIo3LZTY8OlyVrVd5jy_,rap,,"Could You Be Snoop - Bob Marley vs Snoop Dogg - Mashup by DJ Topcat (Tracey Video Remix),fCOBh1SA7EI;Bob Marley & The Wailers - Catch a Fire (Álbum Completo),iYt_E1TlMEE;Ironik - Tuff ft. Snoop Dogg,9YjwzKDFHb4;Snoop Dogg - One More Day (feat. Charlie Wilson) ft. Charlie Wilson,BPmAxzEJpWA;Snoop Dogg - My Heat Goes Boom (Explicit),fJTFiM45v9U;Snoop Dogg Feat Warren G ; The Delinquents & Soul Re - Ballers Night Out,Rg0AT4EHUzg;Snoop Dogg - Bitchees Of Nice (2018),SPRH94XNWxI;Snoop Dogg - Music Makes Me High ft. Xzibit Tha Dogg Pound (Explicit),F4q8WnEECP0;Rick Ross ""Quintessential"" feat. Snoop Dogg (WSHH Exclusive - Official Music Video),qMI6Or9la9Y;Snoop Dogg - Blessing Me Again (feat. Rance Allen) [Official Music Video] ft. Rance Allen,yWJ2DdZjTzU;WAVEYA  sexy dance _ Jason Derulo - ""Wiggle"" feat. Snoop Dogg,YoePCBVO0oY;Ironik - Tuff ft. Snoop Dogg (Official Music Video),9YjwzKDFHb4;Black Eyed Peas - Be Nice Feat. Snoop Dogg,gHN-EhL8x3g;D'Banj ft. Snoop Dogg - Mr Endowed Remix OFFICIAL VIDEO,6xNUOaewOjg;Snoop Dogg - I Wanna Thank Me (feat. Marknoxx) (Official Video),7ehy1-6IuCg;Snoop Dogg - So High,bL9slaZDwSY;Snoop Dogg - Countdown (feat. Swizz Beatz) (Official Video),rpgQD40SIwA;Snoop Dogg - Do It When I'm In It (feat. Jermaine Dupri Ozuna & Slim Jxmmi) (Audio),Wvr9U-qrGNE;Tory Lanez - Beauty In The Benz Ft. Snoop Dogg (Official Music Video),7rouTbviTk4",,snoopdogg,,
Anuel AA,*PLPxFo6bxuI6ldFSQLHy-TGjD6QdhzXDgM,rap,,"Bad Bunny - Volvimos Ft Anuel AA (Video Concept),z0r9hWVpCoQ;Anuel AA Ft. Bad Bunny & Future - Thinkin (Video Oficial),FIFybLYsaOk;Anuel AA Ft. Ele A El Dominio - Amor o Sexo,EqRswRr6t7M;Anuel AA - Tacos Altos (Remix) FT Arcangel  Noriel Farruko y Bryant Myers,ET3ZzJI0rZA;Anuel AA- Conmigo No Forcen [ Remix ] Ft. Ozuna,avg2f1s4E_Y;Ozuna - 69 Ft Anuel AA (Video Concept),rKDeg17j3oE;Anuel AA Ft Noriel & Brytiago - Jersy [Official Video],PS-1eEPEJyY;Anuel AA - El Dia De Mi Funeral (Official Audio) 2017,Y_Tevq1SBMg;Anuel AA - Mi Loba,lO0g8uA2TH0;Que Sería - Anuel AA (Video Oficial),CzfWGTguIP0;Te Bote 2 - Anuel AA Ft Casper Magico Darell Nio Garcia,ribReO58OdA;Anuel AA - Ella Quiere Beber (Remix) ft. Romeo Santos,0w3XwPVxcsw;Anuel AA - Ella Quiere Beber (Video Oficial),BTtBmo5EbEk;BEBE - 6ix9ine Ft. Anuel AA (Prod. By Ronny J) (Official Music Video),ycV6cnK3SIs;Anuel AA - Te Bote Remix (Solo Version),2I0NThQ9vFA;Becky G Natti Natasha - Sin Pijama (Video Oficial),zEf423kYfqk;MANU STONE x TILOUISE - D'ERMERDE AOU (2018),ZIzNL5kZKmM;Lyan x Sou x Yomo - Soñando Despierto (AudioOfficial) MAGICAL CITY,1jU2knXU_-k;Farruko - Oscuridad ft. Anuel AA (Audio),0BrW1Kf9IFE;Te Bote 2 - Anuel AA Ft Nio Garcia Jenifer Lopez Casper (Video Official),_uZopK3Uy7A;Janieck - Does It Matter (Alle Farben Remix) [Official Audio],M9wRMU9XBdQ;John Christian - The Trip,nT2svuj1ymI;Anuel AA - China (Letra) (ft. Karol G J. Balvin  Daddy Yankee  Ozuna),BSWuExn9sC4;Te Bote 2 - Anuel AA Ft Casper Magico Darell  Nio Garcia,ribReO58OdA",,anuelaa,,
Bad Bunny,*PL5BNaoYrNzWMhHDaWJoNiwjSZMo5Kom1G,rap,,"Bad Bunny - Pure Ft. Farruko & Bryant Myers,zww4bDKPTiY;Bad Bunny - Le Falté El Respeto [ Remix ] Ft. Arcángel Farruko & J Alvarez,jle_cPmNNuo;Bad Bunny - Volvimos Ft Anuel AA (Video Concept),z0r9hWVpCoQ;Bad Bunny - Me Rolié,A1NVW90qUEk;Bad Bunny - Polaroid (Video Oficial),_HcDa36sUIw;Tu Misma - Bad Bunny ft Alexis y Fido,RXQCYjlxaG8;Cosculluela Ft. Bad Bunny - Madura,LOYAomlRbxI;Enrique Iglesias - EL BAÑO ft. Bad Bunny,gu9_m0vm7fM;Bad Bunny - Te Lo Meto Yo Ft. Farruko Lary Over Tempo Arcangel,48ciPOVTKck;Bad Bunny - Aquella Noche,eaZxOp5wHsU;Bad Bunny - Solo Avisame,748tGBGIJOU;Bad Bunny - El Challet Remix (Vídeo Clip) Feat. Lary Over Jory Almighty Sou y Alexio,BqwVGKjZebA;J Balvin - Si Tu Novio Te Deja Sola ft. Bad Bunny,Km4BayZykwE;Bad Bunny - Otra Vez [ Remix ] Ft Darell,50iTHSzVVqg;Bad Bunny - Demonia Ft. Brytiago & Jantony,fpBoqX6KfBY;Bad Bunny - Amorfoda | Video Oficial,kLpH1nSLJSs;Bad Bunny - Estamos Bien | Video Oficial,bcHTl9h7TWI;Bad Bunny - Blockia Ft. Farruko,aKhjVTxLwiM;Dime - Chris Brown Ft. Bad Bunny (Video Oficial),OHUGQlpPrx8;BAD BUNNY - QUIERO TENERLA (OFFICIAL VIDEO),D_xk6ZPDELo;Vamos Pa La Calle - Bad Bunny (Video Oficial),bb0ITWc9LYw;Bad Bunny feat. Drake - Mia ( Video Oficial ),OSUxrSe5GbI;Wisin & Yandel ft. Bad Bunny - Dame algo (Video Oficial),ZFdlogQiBPo;Solo De Mi - Bad Bunny ( Video Oficial ),7rbprAR_Reg;YG - ""Bicken Back Being Bool"" (Official Video),rLRHiaC_VQo;Wisin & Yandel Zion & Lennox - Deseo (Audio),rFwHZ66NSI0;MC Lozin e MC Guguinha - Patrão Gigante (GR6 Filmes),vMeNudGNQqc;Mr Vegas - Wakanda Jam (Official Video),ZHr9mXnTDys;Swick Don - Pus!y Pic - August 2018,0s-N4HzjpBA;Caro - Bad Bunny ( Video Oficial ),bg64AFnRnkc;J Balvin - Si Tu Novio Te Deja Sola ft. Bad Bunny (Video Oficial),Km4BayZykwE;Landy (Ft. Dadju) - Muerte (Clip Officiel),HQ_ptUiS4Ns;Bad Bunny - No Me Superas ( Video Oficial ),UMhmehmXrsM;Bad Bunny - Ni Bien Ni Mal,JW3H4qmckoY;Vershon - On and Off Switch (Official Video),jqhsKqdpkeY;Ni Bien Ni Mal - Bad Bunny ( Video Oficial ),4oiZdbwxUuQ;Callaíta - Bad Bunny ( Video Oficial ),acEOASYioGY;Nu-Vybes Band International - Party ""2019 Soca"" (Saint Kitts),XXBhgoUIeN0;DJ ROMS - SHATTA ADDICT (2019),qLGlWnXCU04;Yung Image - Feel So Good (Day Work Riddim) ""2019 Soca"" (Grenada),k6DXaKQyIls;Teddy Rhymez - Forever ""2019 Soca"" (Grenada) | Official Audio,eKcTz6tW-sA;Fadda Fox - Bruk It Off (Big Yam Riddim) ""2019 Soca"" (Barbados) | Official Audio,AckgdqGqsWA;Bad Bunny - Pendiente A Ti Feat. Enrique Iglesias ( Video Oficial Mashups - Cover HDM ),DNkcIfHbwRI;VETE - Bad Bunny ( Video Oficial ),f5aDUB1NCnk",,badbunny,,
Tyga,*PLeRTJl0ikTyskHcpdeJ5QZL7N9t8eTYoY,rap,,"Tyga - Dip (Official Video) ft. Nicki Minaj,YyWru2XOiK0;Tyga - SWISH (Official Music Video),ScdQQfAjFTk;Tyga - Taste (Official Music Video) ft. Offset,LjxulQ1bEWg;Iggy Azalea (feat. Tyga) - Kream | Traducida al español & Lyrics,mZHqaxWT2s4;Iggy Azalea - Kream ft. Tyga (Official Music Video),t7lM7Bn16Zg;Tyga Ft. Offset - Taste,NcxQ0SWAUGI;Digital Sham Ft. Tyga - Taste (Remix) June 2018,QRXOQZ8-v9w;Chris Brown - Straight Up ft. Tyga (Music Video),GRm81IZm1AQ;Tyga - Temperature (Official Video),cgr_RN-1kcc;Tyga - Girls Have Fun (Official Video) ft. Rich The Kid G-Eazy,Y-fqWMaXb8A;Tyga - Goddamn (Official Video),6OLNQiYbGLQ;Tyga - Gabbana ft. Akon Wizkid,5rvlSHRt6dY;Tyga - Lightskin Lil Wayne (Official Video),5ju4JoN3ZKc;Tyga - Ayy Macarena (Official Video),obUHDyWFMi8",,tyga,,
Nicki Minaj,*PLRenhQjuCDJbSSQ6EA4vMojK_E3sjIuly,rap,,"Nicki Minaj - Good Form ft. Lil Wayne,M8GX0cZ-xtw;Nicki Minaj - Bed ft. Ariana Grande (Official Audio),iEky5pIDxJM;Nicki Minaj - Ganja Burn,eMymSXUN9nQ;Ariana Grande - Gimme On Up ft. Nicki Minaj (Official Video),lUgEoHf3Y0E;MaskiriTrevor Dongo and Leonard Mapfumo - Daira (Official Video),GNXrmFPw3cQ;Nicki Minaj - Bardi Done ft. Tory Lanez (Official Video),DKAmXhkCjSc;Ariana Grande - the light is coming ft. Nicki Minaj,OQitfe8u7i4;Nicki Minaj - Barbie Dreams,_bvLphVWHpo;NICKI MINAJ - BARBIE DREAMS (LYRICS),X4zKffF6UNQ;Nicki Minaj - Barbie Tingz,eppa0RXRU-I;Nicki Minaj - Barbie Tingz (Lyric Video),BidS_rcf7UU;Nicki Minaj - Panda (MC Freestyle) [feat. Lady Leshurr Lil Mama & Lil Kim] [MASHUP],BDhybcpSfDk;Nicki Minaj - Cute (feat. Cardi B & CupackKe) [MASHUP],jL0WEvLrbWM;Busta Rhymes - #TWERKIT ft. Nicki Minaj,20cFWzlhhTU;Keyshia Cole - I Ain't Thru ft. Nicki Minaj (Official Video),jdLAvOMHpqo;Trey Songz - Touchin Lovin ft. Nicki Minaj [Official Music Video],cEmrvCiEapM;Fergie - You Already Know ft. Nicki Minaj (Official Music Video),-Ifnaxi2LQg;Nicki Minaj - Anaconda 니키미나즈 아나콘다 WAVEYA Twerking,hm4T0iQr93Q;Nicki Minaj - High School (Explicit) ft. Lil Wayne,RnpyRe_7jZA;Nicki Minaj - Hard White,ChotWwHqLpg;Landy - Le Dyonisien (Clip Officiel),UNZ9G6p1rYs;Avril Lavigne feat. Nicki Minaj - Dumb Blonde (Lyric Video),wC022MwPHKI;Morgan Page - Let You Go (Official Lyric Video),PaN8fh125IQ;Never Wanna Lose You (feat. Justine Skye & Jesper Jenset),M1UVcXW0gcQ;Nicki Minaj - MEGATRON,C3a1sz2Bp_E;Nicki Minaj - SUGE (Remix) (AUDIO),6-8QslChvDA;Nicki Minaj - Megatron (Maxi 2019) Dj 'Skùll,u2TYPawyc8A;Busta Rhymes ft. Nicki Minaj - #TWERKIT (Official Video),20cFWzlhhTU;Nicki Minaj ft. Iggy Azalea - Don't Give Up,bJIQNhh_8Vc;Nicki Minaj - Lats ft. Tory Lanez (Official Video),awPaVL6uijI;DaBaby ""iPHONE"" ft. Nicki Minaj (Music Video),6q6bKw7uIh0;Nicki Minaj ft. Megan Thee Stallion Lil Nas X  Monty - Cookie,Ypumn4k88Mg;a$ap ferg ft. Nicki Minaj - Plain Jane (ilkan Günüç Remix),YTqtH9onHUU",,nickiminaj,,
Juicy J,*PLK-JT3Ii9QKBrQceo66nn0orLuFGYiusE,rap,,"Juicy J - Neighbor (Official Video) ft. Travis Scott,WkSHRrFZFUA;Juicy J - Neighbor (Official Audio) ft. Travis Scott,9mLIVaHp4A4;Juicy J - Let Me See (Official Video) ft. Kevin Gates Lil Skies,p578E7tC9EA;Juicy J - One of Those Nights ft. The Weeknd (Explicit),VP7GNxLI9fM;Megan Thee Stallion - Simon Says ft. Juicy J (Official Audio),i2wX5fDoJXg;Juicy J feat. Wiz Khalifa - Smoke A Nigga,nBApNtVeLfs;Juicy J ft. Travis Scott - Neighbor (Official Video),WkSHRrFZFUA",,juicyj,,
Chevy Woods,*PLKGlqWrLkn_84j7f0jrLoEMp31Jd2hpXm,rap,,undefined,,chevywoods,,
Kanye West,*PLXu_cA-xfxWuJ03QYsdijfMVDRWVv0htk,rap,,"YNW Melly ft. Kanye West - Mixed Personalities (Dir. by @_ColeBennett_),iFv6BXjnKRU",,kanyewest,,
Wiz Khalifa,*PL_bQ3bfYo9ZUyfRE8w95ZmOD7A0P25-SN,rap,,"Wiz Khalifa - Hopeless Romantic feat. Swae Lee [Official Music Video],9VH0fUABBjY;Wiz Khalifa Feat.Two-9 & Ty Dolla $ign - Full House (Official Video),V7m8oZeY-7k;Tekno - One Africa ft. Wiz Khalifa (Official Video),l_kl1upc3bs;Sizzla - Seize The Violence,nhT3CMupgzI;Wiz Khalifa - Fr Fr ft. Lil Skies (Dir. by @_ColeBennett_),d_rongCrYOE;Wiz Khalifa - Universal Studios (Official Video),YuV-Rg7wpbE;Wiz Khalifa - Sleep Feat. 6LACK,zk5fR9dohc0;Wiz Khalifa - Real Rich feat. Gucci Mane [Official Music Video],9nV9GNjXFDo;Joe Moses - Bag ft. Wiz Khalifa [Music Video],PDVVYw1kOr4;Wiz Khalifa - Hopeless Romantic feat. Swae Lee [Official Audio],Sf5CmbLtiew;Wiz Khalifa - What's the Play (Audio),urIn0X0s7R8;Wiz Khalifa - Rolling Papers 2 [Official Music Video],45ezpveOTT8;Dimitri Vegas & Like Mike ft. Wiz Khalifa - When I Grow Up (Official Music Video),a8Foq32Qr90;Wiz Khalifa ft. Smokepurpp - Captain Remix [Official Lyrics],jDmYkbEJGuI;Wiz Khalifa - James Bong [Official Lyrics],ya1xPotKrSM;Ricky P Ft. Wiz Khalifa - Life is a Dream,sZ_MI9Risz4;Wiz Khalifa - We Dem Boyz [Official Video],UX6K7waag5Q;Ty Dolla $ign - Drugs ft. Wiz Khalifa [Official Audio],223-2Jd5P6E;Wiz Khalifa - Something New feat. Ty Dolla $ign [Official Music Video],qxGapEwtq6g;Wiz Khalifa - Garage Talk (Official Video),34RhYeE42RE;Snapchat - Young Deji ft. Wiz Khalifa [Official Video],Lb0UaI51wRU;Baby Goth - Sugar ft. Wiz Khalifa,p98jHW14xt8;THEY. ft. Wiz Khalifa - What I Know Now,F8ccSMKnljA;Wiz Khalifa - See You Again ft. Charlie Puth (8D Audio 🎧),CEGscfSVJXc;Wiz Khalifa - Taylor [Official Video],fCHkzllTW0c;Wiz Khalifa - Hunnid Bands (official video) Prod. By Tay Keith,ziLFJzcSzQc;Juicy J feat. Wiz Khalifa - Smoke A Nigga,nBApNtVeLfs",,wizkhalifa,,
drake,*PL4TrGu5rwzH8GrqIfT69XBI7ytPiPSu-f,rap,,"Drake - In My Feelings,DRS_PpOrUZ4;Meek Mill - Going Bad feat. Drake [Official Audio],T3lKEb0Cs94;Wizkid - No Stress ft. Drake (Official Video),Pz7EFCKimJs;WizKid - Come Closer ft. Drake,vqW18C4plZ8;Bad Bunny feat. Drake - Mia ( Video Oficial ),OSUxrSe5GbI;MC Lozin e MC Guguinha - Patrão Gigante (GR6 Filmes),vMeNudGNQqc;Travis Scott - SICKO MODE ft. Drake,6ONRf7h3Mdk;French Montana - No Stylist ft. Drake,9_k_goMr5ZI;Drake - Talk Up / Lando McHaney Remix (Official Video),gpYzRjQiL7Y;Drake - Scorpion | #TheListeningParty (Ep.3) | Link Up TV,qel92dXuPNo;Drake - Nonstop,lJTRVX9R5EA;Drake - Duppy Freestyle,Qr_QLv1TPcY;Migos - Walk It Talk It ft. Drake,fGqdIPer-ms;Lil Wayne - Family Feud feat. Drake (Official Audio) | Dedication 6 D6 Reloaded,PjqKPHZJgF0;WizKid - Come Closer ft. Drake (Official Video),vqW18C4plZ8;WizKid - Hustle ft. Drake (Official Video),nmy_jfydyxY;Waka Flocka Flame - Round Of Applause feat. Drake (Official HD Video),j5Z3KUOrhS0;Meek Mill - Going Bad feat. Drake (Official Video),S1gp0m4B5p8;French Montana - No Stylist ft. Drake (Official Music Video),9_k_goMr5ZI;Lil Baby ft Drake - Yes Indeed Reggae Wysh,72IVrv80FRc;Drake - Nice For What,U9BwWKXjVaI;Drake - Your Mind ft. Nicki Minaj Cardi B (Official Video),ykXwNmnU6-c;Drake - Closure ft. Lil Baby Ozuna  Stefflon Don  WizKid  Doubledutch,d0JQ2R7zK_s;Travis Scott - SICKO MODE ft. Drake (Official Video),6ONRf7h3Mdk;Drake - Duppy Freestyle (Official Audio),Qr_QLv1TPcY;Swae Lee - Won't Be Late ft. Drake (Lyric Video),iBioIsLoXoE;Rick Ross - Gold Roses ft. Drake,x_UgzesG5Dc;Drake - Closure ft. Lil Baby Ozuna, Stefflon Don, WizKid, Doubledutch,d0JQ2R7zK_s;PARTYNEXTDOOR - Loyal ft. Drake,E68OG9s1IbM;PARTYNEXTDOOR - Loyal feat. Drake [Official Audio],FL7icWyial0;Drake - War,lIlMtVGI5Pg",,drake,,
Eminem,*PLC0w3lEHx2SF3NsbnqnLbWBWyF_3g0cjZ,rap,,"Eminem - The Real Slim Shady (ZIGGY Moombahton Remix),qfOUqQKP08A;Eminem - Lucky You ft. Joyner Lucas,mvSItvjFE1c;Eminem - Fall,MfTbHITdhEI;Eminem - Venom,8CdcCD5V-d8;EMINEM -Change The World (Official video) 2018,JmrRFAwhR3o;EMINEM- God Bless the Dead (2018),SD5IzGgn1yM;EMINEM- A Fine Day (ft. 50 CENT) 2018,mqNlbkgDii4;Eminem - River ft. Ed Sheeran,wfWIs2gFTAM;EMINEM -Fly Away (Official Video),IsJa3z8mdYY;Boogie - Rainy Days ft. Eminem [Audio],ebkd9vweQwU;Eminem - Walk On Water (Audio) ft. Beyoncé,n1WpP7iowLc;Eminem - Ric Flair Drip [ft. Tyga 50 Cent] 2019,ppTwrr5QvD4;Eminem - Pure Water [ft. Migos Mustard] 2019,CWrxzrVXLkA;Childish Major - Naan (Official Audio) Prod. Groove,6atPeJ0tON0;Low Steppa feat. Ayak – No Love,P4Mu9iA0_fE;Eminem - No Way [ft. Lil Wayne] 2019,yWqaYt6TExo;Eminem - Venom (Official Music Video),8CdcCD5V-d8;EMINEM -Change The World 2018,JmrRFAwhR3o;Eminem - River ft. Ed Sheeran (Official Video),wfWIs2gFTAM;Eminem - Don't Tell 'Em [ft. 50 Cent Jeremih] 2019,TmZP2LFlKCg;Eminem - So Cold 2019,xg3ZG0j61yM;Logic - Homicide ft. Eminem,eQkSArQxYJg;Boogie ft. Eminem - Rainy Days (Official Video),2dUMedOr864;Eminem - Paradise [ft. Post Malone] 2019,-ENDgoiJeHo;Canceled: Invitation feat. Eminem (Official Audio),o_WSqMCwjtY;Eminem - Cannon for Nick (NICK CANNON DISS RESPONSE),2d8Ti8uaCng",,eminem,,
Wiz Khalifa - (mixtape),*PLClmWKrXQ6xqqhh3ZqY4v1gS5hR406UMq,rap,,"Wiz Khalifa - Hopeless Romantic feat. Swae Lee [Official Music Video],9VH0fUABBjY;Wiz Khalifa Feat.Two-9 & Ty Dolla $ign - Full House (Official Video),V7m8oZeY-7k;Tekno - One Africa ft. Wiz Khalifa (Official Video),l_kl1upc3bs;Sizzla - Seize The Violence,nhT3CMupgzI;Wiz Khalifa - Fr Fr ft. Lil Skies (Dir. by @_ColeBennett_),d_rongCrYOE;Wiz Khalifa - Universal Studios (Official Video),YuV-Rg7wpbE;Wiz Khalifa - Sleep Feat. 6LACK,zk5fR9dohc0;Wiz Khalifa - Real Rich feat. Gucci Mane [Official Music Video],9nV9GNjXFDo;Joe Moses - Bag ft. Wiz Khalifa [Music Video],PDVVYw1kOr4;Wiz Khalifa - Hopeless Romantic feat. Swae Lee [Official Audio],Sf5CmbLtiew;Wiz Khalifa - What's the Play (Audio),urIn0X0s7R8;Wiz Khalifa - Rolling Papers 2 [Official Music Video],45ezpveOTT8;Dimitri Vegas & Like Mike ft. Wiz Khalifa - When I Grow Up (Official Music Video),a8Foq32Qr90;Wiz Khalifa ft. Smokepurpp - Captain Remix [Official Lyrics],jDmYkbEJGuI;Wiz Khalifa - James Bong [Official Lyrics],ya1xPotKrSM;Ricky P Ft. Wiz Khalifa - Life is a Dream,sZ_MI9Risz4;Wiz Khalifa - We Dem Boyz [Official Video],UX6K7waag5Q;Ty Dolla $ign - Drugs ft. Wiz Khalifa [Official Audio],223-2Jd5P6E;Wiz Khalifa - Something New feat. Ty Dolla $ign [Official Music Video],qxGapEwtq6g;Wiz Khalifa - Garage Talk (Official Video),34RhYeE42RE;Snapchat - Young Deji ft. Wiz Khalifa [Official Video],Lb0UaI51wRU;Baby Goth - Sugar ft. Wiz Khalifa,p98jHW14xt8;THEY. ft. Wiz Khalifa - What I Know Now,F8ccSMKnljA;Wiz Khalifa - See You Again ft. Charlie Puth (8D Audio 🎧),CEGscfSVJXc;Wiz Khalifa - Taylor [Official Video],fCHkzllTW0c;Wiz Khalifa - Hunnid Bands (official video) Prod. By Tay Keith,ziLFJzcSzQc;Juicy J feat. Wiz Khalifa - Smoke A Nigga,nBApNtVeLfs",,wizkhalifa,,
Ty Dolla Sign,*PLQDtEy7VBpb7qywQGBHwUI1Y-Epq5nkp_,rap,,undefined,,tydollasign,,
Ty Dolla Sign - (mixtape),*PLClmWKrXQ6xp9tui1kqfi1swhvhd0cgeS,rap,,undefined,,tydollasign,,
Wiz Khalifa,*PL_bQ3bfYo9ZUyfRE8w95ZmOD7A0P25-SN,rap,,"Wiz Khalifa - Hopeless Romantic feat. Swae Lee [Official Music Video],9VH0fUABBjY;Wiz Khalifa Feat.Two-9 & Ty Dolla $ign - Full House (Official Video),V7m8oZeY-7k;Tekno - One Africa ft. Wiz Khalifa (Official Video),l_kl1upc3bs;Sizzla - Seize The Violence,nhT3CMupgzI;Wiz Khalifa - Fr Fr ft. Lil Skies (Dir. by @_ColeBennett_),d_rongCrYOE;Wiz Khalifa - Universal Studios (Official Video),YuV-Rg7wpbE;Wiz Khalifa - Sleep Feat. 6LACK,zk5fR9dohc0;Wiz Khalifa - Real Rich feat. Gucci Mane [Official Music Video],9nV9GNjXFDo;Joe Moses - Bag ft. Wiz Khalifa [Music Video],PDVVYw1kOr4;Wiz Khalifa - Hopeless Romantic feat. Swae Lee [Official Audio],Sf5CmbLtiew;Wiz Khalifa - What's the Play (Audio),urIn0X0s7R8;Wiz Khalifa - Rolling Papers 2 [Official Music Video],45ezpveOTT8;Dimitri Vegas & Like Mike ft. Wiz Khalifa - When I Grow Up (Official Music Video),a8Foq32Qr90;Wiz Khalifa ft. Smokepurpp - Captain Remix [Official Lyrics],jDmYkbEJGuI;Wiz Khalifa - James Bong [Official Lyrics],ya1xPotKrSM;Ricky P Ft. Wiz Khalifa - Life is a Dream,sZ_MI9Risz4;Wiz Khalifa - We Dem Boyz [Official Video],UX6K7waag5Q;Ty Dolla $ign - Drugs ft. Wiz Khalifa [Official Audio],223-2Jd5P6E;Wiz Khalifa - Something New feat. Ty Dolla $ign [Official Music Video],qxGapEwtq6g;Wiz Khalifa - Garage Talk (Official Video),34RhYeE42RE;Snapchat - Young Deji ft. Wiz Khalifa [Official Video],Lb0UaI51wRU;Baby Goth - Sugar ft. Wiz Khalifa,p98jHW14xt8;THEY. ft. Wiz Khalifa - What I Know Now,F8ccSMKnljA;Wiz Khalifa - See You Again ft. Charlie Puth (8D Audio 🎧),CEGscfSVJXc;Wiz Khalifa - Taylor [Official Video],fCHkzllTW0c;Wiz Khalifa - Hunnid Bands (official video) Prod. By Tay Keith,ziLFJzcSzQc;Juicy J feat. Wiz Khalifa - Smoke A Nigga,nBApNtVeLfs",,wizkhalifa,,
Tyga,*PLeRTJl0ikTyskHcpdeJ5QZL7N9t8eTYoY,rap,,"Tyga - Dip (Official Video) ft. Nicki Minaj,YyWru2XOiK0;Tyga - SWISH (Official Music Video),ScdQQfAjFTk;Tyga - Taste (Official Music Video) ft. Offset,LjxulQ1bEWg;Iggy Azalea (feat. Tyga) - Kream | Traducida al español & Lyrics,mZHqaxWT2s4;Iggy Azalea - Kream ft. Tyga (Official Music Video),t7lM7Bn16Zg;Tyga Ft. Offset - Taste,NcxQ0SWAUGI;Digital Sham Ft. Tyga - Taste (Remix) June 2018,QRXOQZ8-v9w;Chris Brown - Straight Up ft. Tyga (Music Video),GRm81IZm1AQ;Tyga - Temperature (Official Video),cgr_RN-1kcc;Tyga - Girls Have Fun (Official Video) ft. Rich The Kid G-Eazy,Y-fqWMaXb8A;Tyga - Goddamn (Official Video),6OLNQiYbGLQ;Tyga - Gabbana ft. Akon Wizkid,5rvlSHRt6dY;Tyga - Lightskin Lil Wayne (Official Video),5ju4JoN3ZKc;Tyga - Ayy Macarena (Official Video),obUHDyWFMi8",,tyga,,
Akala,*PLI7cIeip1vBvwuV-bmRBfgwMwVXEQk8Q1,rap,,undefined,,akala,,
Fun-Da-Mental,*PL1AYPIBtb1aGcWg4Ru8O_97BWkA74ehjW,rap,,"undefinedPNL - DA [Clip Officiel],9PODnRarD78;Daft Punk - Within,Q5l2ChAqRDg;Daft Punk - Human After All - Electroma,hrB-_nIer88undefined",,fun,da,mental
Ozuna,*PLGM93eHaQyn2y61uVeONUfWttBn7cNVSt,rap...rapGame,,"Ozuna - Luz Apaga feat. Lunay Rauw Alejandro & Lyanno (Video Oficial),TWsq3QPv_Oc;Ozuna - Se Preparó (Video Oficial) | Odisea,KWGrPNqz4uc;New Generation - Ti Koze Si Mwin (Clip Officiel),7uMVZsn4TE0;Ozuna - Quiero Mas Feat. Wisin y Yandel (Video Oficial),2rtWJpvElkQ;Ozuna - Devuélveme  ( Video Oficial ),HOoQCbZh4eo;Ozuna - Me Enamoras (Video Concept),fQMrE8_Pe_s;Ozuna - Coméntale Feat. Akon (Video Oficial),dG1my0cpTc8;NUEVO - Ozuna Feat Maluma Reykon  - Esta Soledad -  Reggaeton 2018,ScClgK72VA0;Ozuna - Como Tu,Czx-IxoqrU0;Ozuna - La Modelo Ft Cardi B (Video Oficial),X8sSXU-J8fI;Ozuna- BAILA BAILA BAILA (Video Oficial),32F2d-wj4Xw;Asesina Remix - Brytiago / Darell / Daddy Yankee / Ozuna / Anuel AA,-wgz-PgW8B4;Germaine - Tú Te Lo Pierdes,8nbAKH_zYeE;J. Balvin - Reggaeton (Official Video),6DHDIDgn2oA;MC IG - 30 Onça e 20 Peixe (GR6 Filmes),QEoMoZ_syhU;MC Ryan SP - Pique de Milionário (GR6 Filmes) DJ LK,YXBKDPDWEf0;MC Livinho - Companhia (GR6 Filmes) Perera DJ,NRrxXavC2k4;Massari - Tune In (Official Video) ft. Afrojack Beenie Man,Tutd1a21Tzc;Logun - Loving Guaranteed ""2018 Reggae"" (Official Audio),UDYMOix2bLM;Di Genius - Pick Up Freestyle [Dancehall],qojDYV40Sqk;Koba LaD - La C,PXNfg73vqn4;Yardycashflow - Unda Grung [Official Music Video HD],jjbu2IZ0rCg;Ozuna - Ibiza (Feat. Romeo Santos) (Audio Oficial),3jyy-1v-GgM;Ozuna - Se Soltó Ft Farruko (Video Oficial),0N4zeKgxLAw;Ozuna - Aura (Feat. Arthur Hanlon) (Audio Oficial),SrloZYkzyl8;Ozuna - El Farsante (Audio Oficial) | Odisea,6DRkf3kZMXw;Ozuna - Mi Dueña Ft. Towy,lkoEUcjnhcY;Don Omar ft. Ozuna - Es Algo Tímida,bpaC66GOFiQ;Carita De Angel - Ozuna (Video Concept),-zy3rUavjrU;Ozuna - Sígueme Los Pasos (Feat. J Balvin & Natti Natasha) (Audio Oficial),wykqGblj1og;Ozuna - Me Dijeron (Video Oficial),JW8_XcwsnOY;NUEVO - Ozuna - Ella y yo (Video Oficial)  Reggaeton 2018,Hn3OgVI4Dx4;Ozuna - Única (Video Oficial) 🐻 A U R A,Ck4xHocysLw;Bali Bandits - Lucky Chances (feat. KSHMR) [Official Audio],FvhBoG3nVUY;Ozuna - Vacía Sin Mí feat. Darell (Video Oficial),NlzbKxS0q5M;Ozuna - Baila Baila Baila (Remix) Feat. Daddy Yankee J Balvin  Farruko  Anuel AA (Audio Oficial),CsSgg_iZHz4;Ozuna - Te Soñé De Nuevo (Video Oficial),eKaD_-Tl544;Ozuna - Amor Genuino (Audio Oficial),jQkJMutvYkA;Ozuna - Hoy Aprendi Feat Daddy Yankee  Farruko  ( Remix - Mashups - Her David ),g2ssoNO-ufk;Lady Essence - Ruff Ryda (Official Music Video) ""2018 Soca"" (Barbados),Jwtn-IcVQzo;Ozuna - Hasta Que Salga El Sol | Cap.2 ( Video Oficial),8-BNyX1DOSo",,ozuna,,
XXXTENTACION,*PL-95FHe5Zg6c4V0dfmwHHei9e2hXvHU5b,rap...rapGame,,"Noah Cyrus - Again ft. XXXTENTACION (Official Video),G_SjnHwxWMU;XXXTENTACION - MOONLIGHT (OFFICIAL MUSIC VIDEO),GX8Hg6kWQYI;XXXTENTACION - Look At Me! (Audio),wJGcwEv7838;XXXTENTACION - SAD! (Official Music Video),iAeYPfrXwk4;XXXTENTACION - Jocelyn Flores (Audio),FAucVNRx_mU;Lil Wayne - Don’t Cry ft. XXXTENTACION,fkLLeOCOQ3w;XXXTENTACION ~ 17 (Album Medley) Cover KidTravisOfficial,PHm9ly82IAM;XXXTENTACION  - Royalty (Official Video) (feat. Ky-Mani Marley Stefflon Don & Vybz Kartel),009XGotXWCs;XXXTENTACION - HOPE (2018),A5SIqkWZLS8;XXXTENTACION - bad vibes forever (Audio) (feat. PnB Rock & Trippie Redd),i-DgvX9Yez4;XXXTENTACION - Hot Gyal (Official Video) (feat. Mavado & Tory Lanez),1H0qgCWlHjs",,xxxtentacion,,
Meek Mill,*PLgEFVNPXJhThJs5FS8d7pLz53b1VPDGkj,rap...rapGame,,"Meek Mill - Going Bad feat. Drake [Official Audio],T3lKEb0Cs94;Meek Mill - Gave Em Hope [Music Video],iDSrPabHsik;Meek Mill Feat. Migos - Contagious [Music Video],HejK-34rONY;Meek Mill - Pray For Em [Music Video],Iu9cEycLhMQ;T.I. - Jefe ft. Meek Mill,NalbryU_EK0;Meek Mill - Millidelphia (feat. Swizz Beats) [Official Audio],fcGIcU3TLtE;Meek Mill - Pablo Escobar (Music Video),8NlqwHxAYyc;Meek Mill - Stay Woke feat. Miguel (Official Audio),dVfdsBtXjQg;Meek Mill Ft. Nicki Minaj & Chris Brown - All Eyes On You (Official Video),ut9ThAbfde0;Cardi B - Revange Remix ft. Meek Mill (Official Video),X_7CyrFQ0tI;Meek Mill - Going Bad feat. Drake (Official Video),S1gp0m4B5p8;Meek Mill - Dangerous (feat. Jeremih & PnB Rock),stcIiJbwpio;Tory Lanez - DrIP DrIp Drip ft. Meek Mill,FR3GPARqdIg;Meek Mill - What's Free feat. Rick Ross & Jay Z [Official Audio],FpNWvxE9nXY;Meek Mill - Oodles O'Noodles Babies [Official Video],hOkqtkvxp-w;Meek Mill - Trauma (Official Video),DU2FWrxiGcI",,meekmill,,
YFN Lucci,*PLovgGWbgSsmAmIFAvtLuMHvBsHprLGAt9,rap...rapGame,,"YFN Lucci - All Night Long feat. Trey Songz [Official Video],r2GaPekM1OQ",,yfnlucci,,
